{
  "root_domain": "cdnet.edu.cn",
  "type": "full_record",
  "org_en": "CERNET Southwest Regional Network Center",
  "org_cn": null,
  "domain_name": "cdnet.edu.cn",
  "network_name": null,
  "admin_contact": "Wenyong Wang (WW1-CN)",
  "nameservers": [
    {
      "host": "dns.cdnet.edu.cn",
      "ip": "202.112.14.161"
    },
    {
      "host": "cdnet52.uestc.edu.cn",
      "ip": "202.112.14.161",
      "ipv6": "2001:da8:6000:0:202:112:14:161"
    }
  ],
  "address": [
    "Chengdu, SC 610054",
    "China"
  ],
  "raw_note": null,
  "schema_version": "2.0",
  "whois_queried": "2026-10-04",
  "source_url": "https://www.nic.edu.cn/cgi-bin/reg/otherobj?query=cdnet.edu.cn",
  "metadata": {
    "organization_or_record_name": "CERNET Southwest Regional Network Center",
    "collected_from": "crt.sh CT",
    "source_last_observed": "2012-11-16T08:02:27; 2014-12-11T08:08:20",
    "current_dns_status": "A=DNS status 2 (Cloudflare fallback); AAAA=DNS status 2 (Cloudflare fallback); NS=DNS status 2 (Cloudflare fallback)",
    "A_records": "",
    "AAAA_records": "",
    "NS_records": "",
    "CERNIC_WHOIS_status": "CERNIC HTTP query: full_record (queried 2026-10-04)",
    "CERNET_address_list_association": "No current A/AAAA overlap found in the public lists; not proof of non-CERNET use",
    "evidence_hostnames": "cdnet.edu.cn; mail.cdnet.edu.cn",
    "review_notes": "Organization type and CERNIC registration not yet individually confirmed; root kept because all edu.cn entities are in scope; DNS may be inactive or query state unavailable; CERNIC IPv6 list combines CERNET and direct-connected/academic ranges; overlap is only a network clue; DNS checked 2026-09-26 via Google Public DNS; transient SERVFAIL retried with Cloudflare DNS where available.; Scope is exactly one label directly under edu.cn; deeper observed hostnames are rolled up to that root. No organization-type filtering.; CERNIC rechecked by background HTTP on 2026-10-04; original discovery and DNS evidence dates retained."
  },
  "reg_date": null,
  "raw_text": "\nWhois Results for cdnet.edu.cn  \n\n\n \n\n\n\nWhois Query\n\n对象关键字查询\n\non accurate entity keys\n\n\n\n\n\n\n\n\n                     \n\n\n\nWhois cdnet.edu.cn  ?\n\n\n\n\nCERNET Southwest Regional Network Center \n   Chengdu, SC 610054\n   China\n\n   Domain Name: cdnet.edu.cn\n\n   Network Name:   \n\n   Administrative Contact, Technical Contact:\n      Wenyong Wang  (WW1-CN) \n\n   Domain Servers in listed order:\n\n   dns.cdnet.edu.cn    \t202.112.14.161\n   cdnet52.uestc.edu.cn\t202.112.14.161\t2001:da8:6000:0:202:112:14:161\n\n\n\n\n\n\n"
}
