{
  "root_domain": "gzeic.edu.cn",
  "type": "full_record",
  "org_en": "Guizhou Electronic Information Professional Technology",
  "org_cn": null,
  "domain_name": "GZEIC.EDU.CN",
  "network_name": "GZEITC-CN",
  "admin_contact": "GuoSong WU (GW33-CER)",
  "nameservers": [
    {
      "host": "dns1.gzeic.edu.cn",
      "ip": "222.198.241.1"
    },
    {
      "host": "dns2.gzeic.edu.cn",
      "ip": "58.16.144.93"
    }
  ],
  "address": [
    "Kaili, GD 556000",
    "China"
  ],
  "raw_note": null,
  "schema_version": "2.0",
  "whois_queried": "2026-09-26",
  "source_url": "https://www.nic.edu.cn/cgi-bin/reg/otherobj?query=gzeic.edu.cn",
  "metadata": {
    "organization_or_record_name": "贵州电子信息职业技术学院",
    "collected_from": "Community-maintained Chinese university-domain index (GitHub)",
    "source_last_observed": "2026-09-26 (source snapshot; no per-domain date)",
    "current_dns_status": "A=DNS status 2; AAAA=DNS status 2; NS=DNS status 2",
    "A_records": "",
    "AAAA_records": "",
    "NS_records": "",
    "CERNIC_WHOIS_status": "Confirmed full CERNIC WHOIS record (queried 2026-09-26)",
    "CERNET_address_list_association": "No current A/AAAA overlap found in the public lists; not proof of non-CERNET use",
    "evidence_hostnames": "www.gzeic.edu.cn",
    "review_notes": "Direct *.edu.cn root candidate discovered via community-maintained China university domain index; not registry-verified. Included regardless of organization type.; DNS checked 2026-09-26 via Google Public DNS DoH.; Also present in community-maintained Chinese university domain index; source is non-official and may be stale. Included without institution-type filtering.; Only one-label-under-edu.cn roots are listed; deeper hostnames roll up to this root. No organization-type filtering.; Legacy schema migration: original WHOIS query date recovered from 2026-10-04 cumulative CSV; original page raw_text unavailable in this per-domain file."
  },
  "reg_date": null,
  "raw_text": null
}
