{
  "root_domain": "lntc.edu.cn",
  "type": "full_record",
  "org_en": "Longnan Normal University",
  "org_cn": null,
  "domain_name": "LNTC.EDU.CN",
  "network_name": "LNSZ-CN",
  "admin_contact": "XiaoRui An (XA2-CER)",
  "nameservers": [
    {
      "host": "dns1.lntc.edu.cn",
      "ip": "222.23.16.6",
      "ipv6": "2001:250:1415:64:de17:1006::"
    },
    {
      "host": "dns2.lntc.edu.cn",
      "ip": "222.23.30.6",
      "ipv6": "2001:250:1415:64:de17:1e06::"
    }
  ],
  "address": [
    "Chengxian, GS 742500",
    "China"
  ],
  "raw_note": null,
  "schema_version": "2.0",
  "whois_queried": "2026-10-04",
  "source_url": "https://www.nic.edu.cn/cgi-bin/reg/otherobj?query=lntc.edu.cn",
  "metadata": {
    "organization_or_record_name": "Longnan Normal University",
    "collected_from": "Community-maintained Chinese university-domain index (GitHub)",
    "source_last_observed": "2026-09-26 (source snapshot; no per-domain date)",
    "current_dns_status": "A=NOERROR; AAAA=NOERROR; NS=NOERROR",
    "A_records": "",
    "AAAA_records": "",
    "NS_records": "ns.lntc.edu.cn",
    "CERNIC_WHOIS_status": "CERNIC HTTP query: full_record (queried 2026-10-04)",
    "CERNET_address_list_association": "No current A/AAAA overlap found in the public lists; not proof of non-CERNET use",
    "evidence_hostnames": "www.lntc.edu.cn",
    "review_notes": "Direct *.edu.cn root candidate discovered via community-maintained China university domain index; not registry-verified. Included regardless of organization type.; DNS checked 2026-09-26 via Google Public DNS DoH.; Also present in community-maintained Chinese university domain index; source is non-official and may be stale. Included without institution-type filtering.; Only one-label-under-edu.cn roots are listed; deeper hostnames roll up to this root. No organization-type filtering.; CERNIC rechecked by background HTTP on 2026-10-04; original discovery and DNS evidence dates retained."
  },
  "reg_date": null,
  "raw_text": "\nWhois Results for lntc.edu.cn  \n\n\n \n\n\n\nWhois Query\n\n对象关键字查询\n\non accurate entity keys\n\n\n\n\n\n\n\n\n                     \n\n\n\nWhois lntc.edu.cn  ?\n\n\n\n\nLongnan Normal University \n   Chengxian, GS 742500\n   China\n\n   Domain Name: LNTC.EDU.CN\n\n   Network Name:   LNSZ-CN\n\n   Administrative Contact, Technical Contact:\n      XiaoRui An  (XA2-CER) \n\n   Domain Servers in listed order:\n\n   dns1.lntc.edu.cn    \t222.23.16.6\t2001:250:1415:64:de17:1006::\n   dns2.lntc.edu.cn    \t222.23.30.6\t2001:250:1415:64:de17:1e06::\n\n\n\n\n\n\n"
}
