{
  "root_domain": "swu.edu.cn",
  "type": "full_record",
  "org_en": "SouthWest University",
  "org_cn": null,
  "domain_name": "SWU.EDU.CN",
  "network_name": "SWNU-CN",
  "admin_contact": "Min Zhou (MZ10-CER)",
  "nameservers": [
    {
      "host": "dns1.swu.edu.cn",
      "ip": "202.202.96.33"
    },
    {
      "host": "dns2.swu.edu.cn",
      "ip": "202.202.96.34"
    }
  ],
  "address": [
    "Chongqing, CQ 400715",
    "China"
  ],
  "raw_note": null,
  "schema_version": "2.0",
  "whois_queried": "2026-09-26",
  "source_url": "https://www.nic.edu.cn/cgi-bin/reg/otherobj?query=swu.edu.cn",
  "metadata": {
    "organization_or_record_name": "西南大学",
    "collected_from": "crt.sh CT; Community-maintained Chinese university-domain index (GitHub)",
    "source_last_observed": "2015-10-13T03:35:31; 2015-12-04T02:46:04; 2015-12-04T02:46:26",
    "current_dns_status": "A=NOERROR; AAAA=NOERROR; NS=NOERROR",
    "A_records": "222.198.120.37",
    "AAAA_records": "",
    "NS_records": "dns2.swu.edu.cn; dns1.swu.edu.cn",
    "CERNIC_WHOIS_status": "Confirmed full CERNIC WHOIS record (queried 2026-09-26)",
    "CERNET_address_list_association": "A overlaps CERNIC IPv4 list: 222.198.120.37",
    "evidence_hostnames": "mail.swu.edu.cn; swu.edu.cn; www.mail.swu.edu.cn; www.swu.edu.cn",
    "review_notes": "Organization type and CERNIC registration not yet individually confirmed; root kept because all edu.cn entities are in scope; CERNIC IPv6 list combines CERNET and direct-connected/academic ranges; overlap is only a network clue; DNS checked 2026-09-26 via Google Public DNS; transient SERVFAIL retried with Cloudflare DNS where available.; Also listed in community-maintained China university domain index; this source is not official and may be stale.; Scope is exactly one label directly under edu.cn; deeper observed hostnames are rolled up to that root. No organization-type filtering.; Also present in community-maintained Chinese university domain index; source is non-official and may be stale. Included without institution-type filtering.; Legacy schema migration: original WHOIS query date recovered from 2026-10-04 cumulative CSV; original page raw_text unavailable in this per-domain file."
  },
  "reg_date": null,
  "raw_text": null
}
