{
  "root_domain": "swufe.edu.cn",
  "type": "full_record",
  "org_en": "Southwest University of Finance & Economics",
  "org_cn": null,
  "domain_name": "SWUFE.EDU.CN",
  "network_name": "SWUFE-CN",
  "admin_contact": "Kanwen Zhou (KZ1-CN)",
  "nameservers": [
    {
      "host": "pridns.swufe.edu.cn",
      "ip": "202.115.112.33"
    },
    {
      "host": "secdns.swufe.edu.cn",
      "ip": "202.115.112.34"
    },
    {
      "host": "dns.swufe.edu.cn",
      "ip": "221.237.161.220"
    }
  ],
  "address": [
    "Chengdu, SC 610074",
    "China"
  ],
  "raw_note": null,
  "schema_version": "2.0",
  "whois_queried": "2026-09-26",
  "source_url": "https://www.nic.edu.cn/cgi-bin/reg/otherobj?query=swufe.edu.cn",
  "metadata": {
    "organization_or_record_name": "西南财经大学",
    "collected_from": "crt.sh CT; Community-maintained Chinese university-domain index (GitHub)",
    "source_last_observed": "2015-04-30T00:00:00; 2015-12-28T00:00:00; 2016-01-14T00:00:00",
    "current_dns_status": "A=NOERROR; AAAA=NOERROR; NS=NOERROR",
    "A_records": "",
    "AAAA_records": "",
    "NS_records": "secdns.swufe.edu.cn; pridns.swufe.edu.cn",
    "CERNIC_WHOIS_status": "Confirmed full CERNIC WHOIS record (queried 2026-09-26)",
    "CERNET_address_list_association": "No current A/AAAA overlap found in the public lists; not proof of non-CERNET use",
    "evidence_hostnames": "swufe.edu.cn; www.swufe.edu.cn",
    "review_notes": "Organization type and CERNIC registration not yet individually confirmed; root kept because all edu.cn entities are in scope; CERNIC IPv6 list combines CERNET and direct-connected/academic ranges; overlap is only a network clue; DNS checked 2026-09-26 via Google Public DNS; transient SERVFAIL retried with Cloudflare DNS where available.; Also listed in community-maintained China university domain index; this source is not official and may be stale.; Scope is exactly one label directly under edu.cn; deeper observed hostnames are rolled up to that root. No organization-type filtering.; Also present in community-maintained Chinese university domain index; source is non-official and may be stale. Included without institution-type filtering.; Legacy schema migration: original WHOIS query date recovered from 2026-10-04 cumulative CSV; original page raw_text unavailable in this per-domain file."
  },
  "reg_date": null,
  "raw_text": null
}
