{
  "root_domain": "tute.edu.cn",
  "type": "full_record",
  "org_en": "Tianjin University of Technology and Education",
  "org_cn": null,
  "domain_name": "TUTE.EDU.CN",
  "network_name": "TJVTTC-CN",
  "admin_contact": "Liancheng Guan (LG32-CER)",
  "nameservers": [
    {
      "host": "DNS.TUTE.EDU.CN",
      "ip": "202.113.244.253"
    },
    {
      "host": "DNS1.TUTE.EDU.CN",
      "ip": "202.113.244.2"
    },
    {
      "host": "DNS2.TUTE.EDU.CN",
      "ip": "202.113.244.12"
    }
  ],
  "address": [
    "Tianjin, TJ 300222",
    "China"
  ],
  "raw_note": null,
  "schema_version": "2.0",
  "whois_queried": "2026-09-26",
  "source_url": "https://www.nic.edu.cn/cgi-bin/reg/otherobj?query=tute.edu.cn",
  "metadata": {
    "organization_or_record_name": "天津职业技术师范大学",
    "collected_from": "Community-maintained Chinese university-domain index (GitHub)",
    "source_last_observed": "2026-09-26 (source snapshot; no per-domain date)",
    "current_dns_status": "A=NOERROR; AAAA=NOERROR; NS=NOERROR",
    "A_records": "",
    "AAAA_records": "",
    "NS_records": "dns3.tute.edu.cn; dns1.tute.edu.cn; dns2.tute.edu.cn",
    "CERNIC_WHOIS_status": "Confirmed full CERNIC WHOIS record (queried 2026-09-26)",
    "CERNET_address_list_association": "No current A/AAAA overlap found in the public lists; not proof of non-CERNET use",
    "evidence_hostnames": "www.tute.edu.cn",
    "review_notes": "Direct *.edu.cn root candidate discovered via community-maintained China university domain index; not registry-verified. Included regardless of organization type.; DNS checked 2026-09-26 via Google Public DNS DoH.; Also present in community-maintained Chinese university domain index; source is non-official and may be stale. Included without institution-type filtering.; Only one-label-under-edu.cn roots are listed; deeper hostnames roll up to this root. No organization-type filtering.; Legacy schema migration: original WHOIS query date recovered from 2026-10-04 cumulative CSV; original page raw_text unavailable in this per-domain file."
  },
  "reg_date": null,
  "raw_text": null
}
