{
  "root_domain": "eei.edu.cn",
  "type": "cn_status",
  "reg_date": "19990702",
  "org_cn": "解放军电子工程学院",
  "org_en": null,
  "network_name": null,
  "admin_contact": null,
  "nameservers": [],
  "raw_note": "域名 eei.edu.cn  已于19990702 在CERNIC注册 [解放军电子工程学院]",
  "schema_version": "2.0",
  "whois_queried": "2026-09-26",
  "source_url": "https://www.nic.edu.cn/cgi-bin/reg/otherobj?query=eei.edu.cn",
  "metadata": {
    "organization_or_record_name": "解放军电子工程学院",
    "collected_from": "CERNET导报 1999 Q3, CERNIC新增域名表; CERNET导报 1999 Q4, CERNIC域名注册清单",
    "source_last_observed": "1998-1999 registry publication",
    "current_dns_status": "A=NXDOMAIN; AAAA=NXDOMAIN; NS=NXDOMAIN",
    "A_records": "",
    "AAAA_records": "",
    "NS_records": "",
    "CERNIC_WHOIS_status": "Confirmed registered in CERNIC; registration date 19990702 (queried 2026-09-26)",
    "CERNET_address_list_association": "No current A/AAAA overlap found in the public lists; not proof of non-CERNET use",
    "evidence_hostnames": "eei.edu.cn",
    "review_notes": "Historical official CERNET/CERNIC domain-registration table entry. Retained even if current DNS is absent; organization type is not filtered.; Historical CERNIC registration entry; kept irrespective of organization category or present DNS state.; DNS checked 2026-09-26 via Google Public DNS DoH.; Scope is exactly one label directly under edu.cn; deeper observed hostnames are rolled up to that root. No organization-type filtering.; Legacy schema migration: original WHOIS query date recovered from 2026-10-04 cumulative CSV; original page raw_text unavailable in this per-domain file."
  },
  "domain_name": null,
  "raw_text": null,
  "address": []
}
