{
  "root_domain": "lingnan.edu.cn",
  "type": "full_record",
  "org_en": "LingNan Normal University",
  "org_cn": null,
  "domain_name": "LINGNAN.EDU.CN",
  "network_name": "ZHANJNC-CN",
  "admin_contact": "Faxin Zhao (FZ24-CER)",
  "nameservers": [
    {
      "host": "LINGNAN1.LINGNAN.EDU.CN",
      "ip": "202.192.128.33",
      "ipv6": "2001:250:3009::2800:133"
    }
  ],
  "address": [
    "Zhanjiang, GD 524048",
    "China"
  ],
  "raw_note": null,
  "schema_version": "2.0",
  "whois_queried": "2026-10-04",
  "source_url": "https://www.nic.edu.cn/cgi-bin/reg/otherobj?query=lingnan.edu.cn",
  "metadata": {
    "organization_or_record_name": "LingNan Normal University",
    "collected_from": "Community-maintained Chinese university-domain index (GitHub)",
    "source_last_observed": "2026-09-26 (source snapshot; no per-domain date)",
    "current_dns_status": "A=NOERROR; AAAA=NOERROR; NS=NOERROR",
    "A_records": "",
    "AAAA_records": "",
    "NS_records": "ns.lingnan.edu.cn; lingnan1.lingnan.edu.cn; lingnan2.lingnan.edu.cn",
    "CERNIC_WHOIS_status": "CERNIC HTTP query: full_record (queried 2026-10-04)",
    "CERNET_address_list_association": "No current A/AAAA overlap found in the public lists; not proof of non-CERNET use",
    "evidence_hostnames": "www.lingnan.edu.cn",
    "review_notes": "Direct *.edu.cn root candidate discovered via community-maintained China university domain index; not registry-verified. Included regardless of organization type.; DNS checked 2026-09-26 via Google Public DNS DoH.; Also present in community-maintained Chinese university domain index; source is non-official and may be stale. Included without institution-type filtering.; Only one-label-under-edu.cn roots are listed; deeper hostnames roll up to this root. No organization-type filtering.; CERNIC rechecked by background HTTP on 2026-10-04; original discovery and DNS evidence dates retained."
  },
  "reg_date": null,
  "raw_text": "\nWhois Results for lingnan.edu.cn  \n\n\n \n\n\n\nWhois Query\n\n对象关键字查询\n\non accurate entity keys\n\n\n\n\n\n\n\n\n                     \n\n\n\nWhois lingnan.edu.cn  ?\n\n\n\n\nLingNan Normal University \n   Zhanjiang, GD 524048\n   China\n\n   Domain Name: LINGNAN.EDU.CN\n\n   Network Name:   ZHANJNC-CN\n\n   Administrative Contact, Technical Contact:\n      Faxin Zhao  (FZ24-CER) \n\n   Domain Servers in listed order:\n\n   LINGNAN1.LINGNAN.EDU.CN\t202.192.128.33\t2001:250:3009::2800:133\n\n\n\n\n\n\n"
}
