{
  "root_domain": "neu6.edu.cn",
  "type": "full_record",
  "org_en": "Northeastern University",
  "org_cn": null,
  "domain_name": "NEU6.EDU.CN",
  "network_name": "NEU-CN",
  "admin_contact": "Zhankao Wen (ZW45-CER)",
  "nameservers": [
    {
      "host": "ns.neu.edu.cn",
      "ip": "202.118.1.35"
    },
    {
      "host": "ns1.neu.edu.cn",
      "ip": "202.118.1.45"
    }
  ],
  "address": [
    "Shenyang, LN 110004",
    "China"
  ],
  "raw_note": null,
  "schema_version": "2.0",
  "whois_queried": "2026-09-26",
  "source_url": "https://www.nic.edu.cn/cgi-bin/reg/otherobj?query=neu6.edu.cn",
  "metadata": {
    "organization_or_record_name": "Northeastern University",
    "collected_from": "crt.sh CT",
    "source_last_observed": "2012-02-24T04:36:36; 2012-04-13T08:40:26; 2014-01-15T17:56:43",
    "current_dns_status": "A=NOERROR; AAAA=NOERROR; NS=NOERROR",
    "A_records": "",
    "AAAA_records": "2001:da8:9000:e100::171; 2001:da8:9000:e100::172",
    "NS_records": "ns1.neu.edu.cn; ns.neu.edu.cn",
    "CERNIC_WHOIS_status": "Confirmed full CERNIC WHOIS record (queried 2026-09-26)",
    "CERNET_address_list_association": "AAAA overlaps CERNIC-published IPv6 address/peering list: 2001:da8:9000:e100::171; AAAA overlaps CERNIC-published IPv6 address/peering list: 2001:da8:9000:e100::172",
    "evidence_hostnames": "idp.neu6.edu.cn; isp.neu6.edu.cn; neu6.edu.cn",
    "review_notes": "Organization type and CERNIC registration not yet individually confirmed; root kept because all edu.cn entities are in scope; CERNIC IPv6 list combines CERNET and direct-connected/academic ranges; overlap is only a network clue; DNS checked 2026-09-26 via Google Public DNS; transient SERVFAIL retried with Cloudflare DNS where available.; Scope is exactly one label directly under edu.cn; deeper observed hostnames are rolled up to that root. No organization-type filtering.; Legacy schema migration: original WHOIS query date recovered from 2026-10-04 cumulative CSV; original page raw_text unavailable in this per-domain file."
  },
  "reg_date": null,
  "raw_text": null
}
