{
  "root_domain": "bjczy.edu.cn",
  "type": "full_record",
  "org_en": "Institute of Finance & Management Beijing",
  "org_cn": null,
  "domain_name": "BJCZY.EDU.CN",
  "network_name": "BJCZY-CN",
  "admin_contact": "Wenshan Li (WL73-CER)",
  "nameservers": [
    {
      "host": "dns.bjczy.edu.cn",
      "ip": "222.199.160.81",
      "ipv6": "2001:da8:27a:1007::3"
    },
    {
      "host": "dns1.bjczy.edu.cn",
      "ip": "219.143.12.81"
    },
    {
      "host": "dns2.bjczy.edu.cn",
      "ip": "111.198.102.81"
    }
  ],
  "address": [
    "Beijing, BJ 100010",
    "China"
  ],
  "raw_note": null,
  "schema_version": "2.0",
  "whois_queried": "2026-10-04",
  "source_url": "https://www.nic.edu.cn/cgi-bin/reg/otherobj?query=bjczy.edu.cn",
  "metadata": {
    "organization_or_record_name": "Institute of Finance & Management Beijing",
    "collected_from": "crt.sh CT; Community-maintained Chinese university-domain index (GitHub)",
    "source_last_observed": "2012-11-20T12:47:51; 2014-11-30T06:44:25; 2016-10-20T00:00:00",
    "current_dns_status": "A=NOERROR; AAAA=NOERROR; NS=NOERROR",
    "A_records": "219.143.12.229",
    "AAAA_records": "240e:604:791:13fc::2; 240e:604:791:13fd::2; 2001:da8:27a:ffff::1:2",
    "NS_records": "dns1.bjczy.edu.cn; dns2.bjczy.edu.cn; dns.bjczy.edu.cn",
    "CERNIC_WHOIS_status": "CERNIC HTTP query: full_record (queried 2026-10-04)",
    "CERNET_address_list_association": "AAAA overlaps CERNIC-published IPv6 address/peering list: 2001:da8:27a:ffff::1:2",
    "evidence_hostnames": "bjczy.edu.cn; vpn.bjczy.edu.cn; webvpn.bjczy.edu.cn; www.bjczy.edu.cn",
    "review_notes": "Organization type and CERNIC registration not yet individually confirmed; root kept because all edu.cn entities are in scope; CERNIC IPv6 list combines CERNET and direct-connected/academic ranges; overlap is only a network clue; DNS checked 2026-09-26 via Google Public DNS; transient SERVFAIL retried with Cloudflare DNS where available.; Also listed in community-maintained China university domain index; this source is not official and may be stale.; Scope is exactly one label directly under edu.cn; deeper observed hostnames are rolled up to that root. No organization-type filtering.; Also present in community-maintained Chinese university domain index; source is non-official and may be stale. Included without institution-type filtering.; CERNIC rechecked by background HTTP on 2026-10-04; original discovery and DNS evidence dates retained."
  },
  "reg_date": null,
  "raw_text": "\nWhois Results for bjczy.edu.cn  \n\n\n \n\n\n\nWhois Query\n\n对象关键字查询\n\non accurate entity keys\n\n\n\n\n\n\n\n\n                     \n\n\n\nWhois bjczy.edu.cn  ?\n\n\n\n\nInstitute of Finance & Management Beijing \n   Beijing, BJ 100010\n   China\n\n   Domain Name: BJCZY.EDU.CN\n\n   Network Name:   BJCZY-CN\n\n   Administrative Contact, Technical Contact:\n      Wenshan Li  (WL73-CER) \n\n   Domain Servers in listed order:\n\n   dns.bjczy.edu.cn    \t222.199.160.81\t2001:da8:27a:1007::3\n   dns1.bjczy.edu.cn   \t219.143.12.81\n   dns2.bjczy.edu.cn   \t111.198.102.81\n\n\n\n\n\n\n"
}
