{
  "root_domain": "sit.edu.cn",
  "type": "full_record",
  "org_en": "上海应用技术大学",
  "org_cn": null,
  "domain_name": "SIT.EDU.CN",
  "network_name": "SHCM-CN",
  "admin_contact": "Jiageng Chen (JC4-CER)",
  "nameservers": [
    {
      "host": "ns.sit.edu.cn",
      "ip": "210.35.96.2"
    },
    {
      "host": "ns1.sit.edu.cn",
      "ip": "210.35.96.6"
    }
  ],
  "address": [
    "Shanghai, SH 201418",
    "China"
  ],
  "raw_note": null,
  "schema_version": "2.0",
  "whois_queried": "2026-09-26",
  "source_url": "https://www.nic.edu.cn/cgi-bin/reg/otherobj?query=sit.edu.cn",
  "metadata": {
    "organization_or_record_name": "上海应用技术大学",
    "collected_from": "Community-maintained Chinese university-domain index (GitHub)",
    "source_last_observed": "2026-09-26 (source snapshot; no per-domain date)",
    "current_dns_status": "A=NOERROR; AAAA=NOERROR; NS=NOERROR",
    "A_records": "",
    "AAAA_records": "",
    "NS_records": "ns1.sit.edu.cn; ns.sit.edu.cn",
    "CERNIC_WHOIS_status": "Confirmed full CERNIC WHOIS record (queried 2026-09-26)",
    "CERNET_address_list_association": "No current A/AAAA overlap found in the public lists; not proof of non-CERNET use",
    "evidence_hostnames": "www.sit.edu.cn",
    "review_notes": "Direct *.edu.cn root candidate discovered via community-maintained China university domain index; not registry-verified. Included regardless of organization type.; DNS checked 2026-09-26 via Google Public DNS DoH.; Also present in community-maintained Chinese university domain index; source is non-official and may be stale. Included without institution-type filtering.; Only one-label-under-edu.cn roots are listed; deeper hostnames roll up to this root. No organization-type filtering.; Legacy schema migration: original WHOIS query date recovered from 2026-10-04 cumulative CSV; original page raw_text unavailable in this per-domain file."
  },
  "reg_date": null,
  "raw_text": null
}
