{
  "root_domain": "kmu.edu.cn",
  "type": "full_record",
  "org_en": "Kunming University",
  "org_cn": null,
  "domain_name": "KMU.EDU.CN",
  "network_name": "KMU-CN",
  "admin_contact": "Zhenbi Liang (ZL109-CER)",
  "nameservers": [
    {
      "host": "DNS.KMU.EDU.CN",
      "ip": "202.203.0.202",
      "ipv6": "2001:250:2802:2222::2222"
    },
    {
      "host": "DNS2.KMU.EDU.CN",
      "ip": "202.203.6.202",
      "ipv6": "2001:250:2802:3333::3333"
    }
  ],
  "address": [
    "Kunming, YN 650214",
    "China"
  ],
  "raw_note": null,
  "schema_version": "2.0",
  "whois_queried": "2026-10-04",
  "source_url": "https://www.nic.edu.cn/cgi-bin/reg/otherobj?query=kmu.edu.cn",
  "metadata": {
    "organization_or_record_name": "Kunming University",
    "collected_from": "crt.sh CT; Community-maintained Chinese university-domain index (GitHub)",
    "source_last_observed": "2015-12-15T00:50:12; 2015-12-15T01:58:24",
    "current_dns_status": "A=NOERROR; AAAA=NOERROR; NS=NOERROR",
    "A_records": "",
    "AAAA_records": "",
    "NS_records": "dns.kmu.edu.cn; secdns.kmu.edu.cn",
    "CERNIC_WHOIS_status": "CERNIC HTTP query: full_record (queried 2026-10-04)",
    "CERNET_address_list_association": "No current A/AAAA overlap found in the public lists; not proof of non-CERNET use",
    "evidence_hostnames": "kyjf.kmu.edu.cn; kymis.kmu.edu.cn; www.kmu.edu.cn",
    "review_notes": "Organization type and CERNIC registration not yet individually confirmed; root kept because all edu.cn entities are in scope; CERNIC IPv6 list combines CERNET and direct-connected/academic ranges; overlap is only a network clue; DNS checked 2026-09-26 via Google Public DNS; transient SERVFAIL retried with Cloudflare DNS where available.; Also listed in community-maintained China university domain index; this source is not official and may be stale.; Scope is exactly one label directly under edu.cn; deeper observed hostnames are rolled up to that root. No organization-type filtering.; Also present in community-maintained Chinese university domain index; source is non-official and may be stale. Included without institution-type filtering.; CERNIC rechecked by background HTTP on 2026-10-04; original discovery and DNS evidence dates retained."
  },
  "reg_date": null,
  "raw_text": "\nWhois Results for kmu.edu.cn  \n\n\n \n\n\n\nWhois Query\n\n对象关键字查询\n\non accurate entity keys\n\n\n\n\n\n\n\n\n                     \n\n\n\nWhois kmu.edu.cn  ?\n\n\n\n\nKunming University \n   Kunming, YN 650214\n   China\n\n   Domain Name: KMU.EDU.CN\n\n   Network Name:   KMU-CN\n\n   Administrative Contact, Technical Contact:\n      Zhenbi Liang  (ZL109-CER) \n\n   Domain Servers in listed order:\n\n   DNS.KMU.EDU.CN      \t202.203.0.202\t2001:250:2802:2222::2222\n   DNS2.KMU.EDU.CN     \t202.203.6.202\t2001:250:2802:3333::3333\n\n\n\n\n\n\n"
}
