{
  "root_domain": "zhku.edu.cn",
  "type": "full_record",
  "org_en": "Zhongkai University of Agriculture and Engineering",
  "org_cn": null,
  "domain_name": "ZHKU.EDU.CN",
  "network_name": "ZKAIT-CN",
  "admin_contact": "Yi Lu (YL29-CER)",
  "nameservers": [
    {
      "host": "ns1.service.edu.cn",
      "ip": "202.112.5.49",
      "ipv6": "2001:da8:257:1111::8888"
    },
    {
      "host": "ns2.service.edu.cn",
      "ip": "202.112.4.49",
      "ipv6": "2001:da8:257:2222::8888"
    }
  ],
  "address": [
    "Guangzhou, GD 510225",
    "China"
  ],
  "raw_note": null,
  "schema_version": "2.0",
  "whois_queried": "2026-10-04",
  "source_url": "https://www.nic.edu.cn/cgi-bin/reg/otherobj?query=zhku.edu.cn",
  "metadata": {
    "organization_or_record_name": "Zhongkai University of Agriculture and Engineering",
    "collected_from": "Community-maintained Chinese university-domain index (GitHub)",
    "source_last_observed": "2026-09-26 (source snapshot; no per-domain date)",
    "current_dns_status": "A=NOERROR; AAAA=NOERROR; NS=NOERROR",
    "A_records": "",
    "AAAA_records": "2001:da8:202b::2; 2001:da8:2032:1006::37; 2001:da8:2032:1006::38",
    "NS_records": "ns1.service.edu.cn; ns2.service.edu.cn",
    "CERNIC_WHOIS_status": "CERNIC HTTP query: full_record (queried 2026-10-04)",
    "CERNET_address_list_association": "AAAA overlaps CERNIC-published IPv6 address/peering list: 2001:da8:202b::2; AAAA overlaps CERNIC-published IPv6 address/peering list: 2001:da8:2032:1006::37; AAAA overlaps CERNIC-published IPv6 address/peering list: 2001:da8:2032:1006::38",
    "evidence_hostnames": "www.zhku.edu.cn",
    "review_notes": "Direct *.edu.cn root candidate discovered via community-maintained China university domain index; not registry-verified. Included regardless of organization type.; DNS checked 2026-09-26 via Google Public DNS DoH.; Also present in community-maintained Chinese university domain index; source is non-official and may be stale. Included without institution-type filtering.; Only one-label-under-edu.cn roots are listed; deeper hostnames roll up to this root. No organization-type filtering.; CERNIC rechecked by background HTTP on 2026-10-04; original discovery and DNS evidence dates retained."
  },
  "reg_date": null,
  "raw_text": "\nWhois Results for zhku.edu.cn  \n\n\n \n\n\n\nWhois Query\n\n对象关键字查询\n\non accurate entity keys\n\n\n\n\n\n\n\n\n                     \n\n\n\nWhois zhku.edu.cn  ?\n\n\n\n\nZhongkai University of Agriculture and Engineering \n   Guangzhou, GD 510225\n   China\n\n   Domain Name: ZHKU.EDU.CN\n\n   Network Name:   ZKAIT-CN\n\n   Administrative Contact, Technical Contact:\n      Yi Lu  (YL29-CER) \n\n   Domain Servers in listed order:\n\n   ns1.service.edu.cn  \t202.112.5.49\t2001:da8:257:1111::8888\n   ns2.service.edu.cn  \t202.112.4.49\t2001:da8:257:2222::8888\n\n\n\n\n\n\n"
}
