{
  "root_domain": "eeagd.edu.cn",
  "type": "full_record",
  "org_en": "The center for the Education Examinations Authority of",
  "org_cn": null,
  "domain_name": "EEAGD.EDU.CN",
  "network_name": "GDGZB-CN",
  "admin_contact": "Jingyun Li (JL142-CER)",
  "nameservers": [
    {
      "host": "eeagd1.eeagd.edu.cn",
      "ip": "202.116.236.33"
    },
    {
      "host": "eeagd2.eeagd.edu.cn",
      "ip": "183.62.28.4"
    },
    {
      "host": "eeagd3.eeagd.edu.cn",
      "ip": "202.116.236.34"
    }
  ],
  "address": [
    "Guangzhou, GD 510631",
    "China"
  ],
  "raw_note": null,
  "schema_version": "2.0",
  "whois_queried": "2026-10-04",
  "source_url": "https://www.nic.edu.cn/cgi-bin/reg/otherobj?query=eeagd.edu.cn",
  "metadata": {
    "organization_or_record_name": "The center for the Education Examinations Authority of",
    "collected_from": "crt.sh CT",
    "source_last_observed": "2016-05-12T06:13:16",
    "current_dns_status": "A=NOERROR; AAAA=NOERROR; NS=NOERROR",
    "A_records": "",
    "AAAA_records": "",
    "NS_records": "eeagd1.eeagd.edu.cn; eeagd3.eeagd.edu.cn",
    "CERNIC_WHOIS_status": "CERNIC HTTP query: full_record (queried 2026-10-04)",
    "CERNET_address_list_association": "No current A/AAAA overlap found in the public lists; not proof of non-CERNET use",
    "evidence_hostnames": "eeagd.edu.cn; www.eeagd.edu.cn",
    "review_notes": "Organization type and CERNIC registration not yet individually confirmed; root kept because all edu.cn entities are in scope; CERNIC IPv6 list combines CERNET and direct-connected/academic ranges; overlap is only a network clue; DNS checked 2026-09-26 via Google Public DNS; transient SERVFAIL retried with Cloudflare DNS where available.; Scope is exactly one label directly under edu.cn; deeper observed hostnames are rolled up to that root. No organization-type filtering.; CERNIC rechecked by background HTTP on 2026-10-04; original discovery and DNS evidence dates retained."
  },
  "reg_date": null,
  "raw_text": "\nWhois Results for eeagd.edu.cn  \n\n\n \n\n\n\nWhois Query\n\n对象关键字查询\n\non accurate entity keys\n\n\n\n\n\n\n\n\n                     \n\n\n\nWhois eeagd.edu.cn  ?\n\n\n\n\nThe center for the Education Examinations Authority of \n   Guangzhou, GD 510631\n   China\n\n   Domain Name: EEAGD.EDU.CN\n\n   Network Name:   GDGZB-CN\n\n   Administrative Contact, Technical Contact:\n      Jingyun Li  (JL142-CER) \n\n   Domain Servers in listed order:\n\n   eeagd1.eeagd.edu.cn \t202.116.236.33\n   eeagd2.eeagd.edu.cn \t183.62.28.4\n   eeagd3.eeagd.edu.cn \t202.116.236.34\n\n\n\n\n\n\n"
}
