{
  "root_domain": "sdupsl.edu.cn",
  "type": "full_record",
  "org_en": "Shandong University of Political science and Law",
  "org_cn": null,
  "domain_name": "SDUPSL.EDU.CN",
  "network_name": "SDPLMCI-CN",
  "admin_contact": "Zhonghui Jiao (ZJ6-CER)",
  "nameservers": [
    {
      "host": "dns1.sdupsl.edu.cn",
      "ip": "211.64.8.1"
    },
    {
      "host": "dns2.sdupsl.edu.cn",
      "ip": "211.64.8.5"
    }
  ],
  "address": [
    "Jinan, SD 250014",
    "China"
  ],
  "raw_note": null,
  "schema_version": "2.0",
  "whois_queried": "2026-10-04",
  "source_url": "https://www.nic.edu.cn/cgi-bin/reg/otherobj?query=sdupsl.edu.cn",
  "metadata": {
    "organization_or_record_name": "Shandong University of Political science and Law",
    "collected_from": "Community-maintained Chinese university-domain index (GitHub)",
    "source_last_observed": "2026-09-26 (source snapshot; no per-domain date)",
    "current_dns_status": "A=NOERROR; AAAA=NOERROR; NS=NOERROR",
    "A_records": "",
    "AAAA_records": "",
    "NS_records": "dns2.sdupsl.edu.cn; dns1.sdupsl.edu.cn",
    "CERNIC_WHOIS_status": "CERNIC HTTP query: full_record (queried 2026-10-04)",
    "CERNET_address_list_association": "No current A/AAAA overlap found in the public lists; not proof of non-CERNET use",
    "evidence_hostnames": "www.sdupsl.edu.cn",
    "review_notes": "Direct *.edu.cn root candidate discovered via community-maintained China university domain index; not registry-verified. Included regardless of organization type.; DNS checked 2026-09-26 via Google Public DNS DoH.; Also present in community-maintained Chinese university domain index; source is non-official and may be stale. Included without institution-type filtering.; Only one-label-under-edu.cn roots are listed; deeper hostnames roll up to this root. No organization-type filtering.; CERNIC rechecked by background HTTP on 2026-10-04; original discovery and DNS evidence dates retained."
  },
  "reg_date": null,
  "raw_text": "\nWhois Results for sdupsl.edu.cn  \n\n\n \n\n\n\nWhois Query\n\n对象关键字查询\n\non accurate entity keys\n\n\n\n\n\n\n\n\n                     \n\n\n\nWhois sdupsl.edu.cn  ?\n\n\n\n\nShandong University of Political science and Law \n   Jinan, SD 250014\n   China\n\n   Domain Name: SDUPSL.EDU.CN\n\n   Network Name:   SDPLMCI-CN\n\n   Administrative Contact:\n      Zhonghui Jiao  (ZJ6-CER) \n   Network Name:   SDPLMCI-CN\n\n   Technical Contact:\n      Yan Li  (YL128-CER) \n\n   Domain Servers in listed order:\n\n   dns1.sdupsl.edu.cn  \t211.64.8.1\n   dns2.sdupsl.edu.cn  \t211.64.8.5\n\n\n\n\n\n\n"
}
