{
  "root_domain": "tjut.edu.cn",
  "type": "full_record",
  "org_en": "Tianjin Institute Of Technology",
  "org_cn": null,
  "domain_name": "TJUT.EDU.CN",
  "network_name": "TJIT-CN",
  "admin_contact": "Changyun Yu (CY3-CN)",
  "nameservers": [
    {
      "host": "dns1.tjut.edu.cn",
      "ip": "59.67.148.5",
      "ipv6": "2001:da8:a001:2::3"
    },
    {
      "host": "dns.tjut.edu.cn",
      "ip": "202.113.64.3",
      "ipv6": "2001:da8:a001:5::5"
    }
  ],
  "address": [
    "Tianjin, TJ 300191",
    "China"
  ],
  "raw_note": null,
  "schema_version": "2.0",
  "whois_queried": "2026-10-04",
  "source_url": "https://www.nic.edu.cn/cgi-bin/reg/otherobj?query=tjut.edu.cn",
  "metadata": {
    "organization_or_record_name": "Tianjin Institute Of Technology",
    "collected_from": "crt.sh CT; Community-maintained Chinese university-domain index (GitHub)",
    "source_last_observed": "2013-03-05T14:33:11",
    "current_dns_status": "A=NOERROR; AAAA=NOERROR; NS=NOERROR",
    "A_records": "",
    "AAAA_records": "",
    "NS_records": "dns1.tjut.edu.cn; dns.tjut.edu.cn",
    "CERNIC_WHOIS_status": "CERNIC HTTP query: full_record (queried 2026-10-04)",
    "CERNET_address_list_association": "No current A/AAAA overlap found in the public lists; not proof of non-CERNET use",
    "evidence_hostnames": "mail.tjut.edu.cn; tjut.edu.cn; www.tjut.edu.cn",
    "review_notes": "Organization type and CERNIC registration not yet individually confirmed; root kept because all edu.cn entities are in scope; CERNIC IPv6 list combines CERNET and direct-connected/academic ranges; overlap is only a network clue; DNS checked 2026-09-26 via Google Public DNS; transient SERVFAIL retried with Cloudflare DNS where available.; Also listed in community-maintained China university domain index; this source is not official and may be stale.; Scope is exactly one label directly under edu.cn; deeper observed hostnames are rolled up to that root. No organization-type filtering.; Also present in community-maintained Chinese university domain index; source is non-official and may be stale. Included without institution-type filtering.; CERNIC rechecked by background HTTP on 2026-10-04; original discovery and DNS evidence dates retained."
  },
  "reg_date": null,
  "raw_text": "\nWhois Results for tjut.edu.cn  \n\n\n \n\n\n\nWhois Query\n\n对象关键字查询\n\non accurate entity keys\n\n\n\n\n\n\n\n\n                     \n\n\n\nWhois tjut.edu.cn  ?\n\n\n\n\nTianjin Institute Of Technology \n   Tianjin, TJ 300191\n   China\n\n   Domain Name: TJUT.EDU.CN\n\n   Network Name:   TJIT-CN\n\n   Administrative Contact:\n      Changyun Yu  (CY3-CN) \n   Network Name:   TJIT-CN\n\n   Technical Contact:\n      Ming Xue  (XM2-CN) \n\n   Domain Servers in listed order:\n\n   dns1.tjut.edu.cn    \t59.67.148.5\t2001:da8:a001:2::3\n   dns.tjut.edu.cn     \t202.113.64.3\t2001:da8:a001:5::5\n\n\n\n\n\n\n"
}
