{
  "root_domain": "njxzc.edu.cn",
  "type": "full_record",
  "org_en": "Nanjing Xiaozhuang College",
  "org_cn": null,
  "domain_name": "NJXZC.EDU.CN",
  "network_name": "NJNC-CN",
  "admin_contact": "Guangyong Song (GS1-CER)",
  "nameservers": [
    {
      "host": "dns1.njxzc.edu.cn",
      "ip": "210.29.144.1"
    },
    {
      "host": "dns2.njxzc.edu.cn",
      "ip": "210.29.144.2"
    }
  ],
  "address": [
    "Nanjing, JS 210017",
    "China"
  ],
  "raw_note": null,
  "schema_version": "2.0",
  "whois_queried": "2026-10-04",
  "source_url": "https://www.nic.edu.cn/cgi-bin/reg/otherobj?query=njxzc.edu.cn",
  "metadata": {
    "organization_or_record_name": "Nanjing Xiaozhuang College",
    "collected_from": "crt.sh CT; Community-maintained Chinese university-domain index (GitHub)",
    "source_last_observed": "2015-09-07T05:11:54; 2015-09-07T05:25:02; 2016-08-12T02:53:24",
    "current_dns_status": "A=NOERROR; AAAA=NOERROR; NS=NOERROR",
    "A_records": "210.29.144.1",
    "AAAA_records": "",
    "NS_records": "dns1.njxzc.edu.cn",
    "CERNIC_WHOIS_status": "CERNIC HTTP query: full_record (queried 2026-10-04)",
    "CERNET_address_list_association": "A overlaps CERNIC IPv4 list: 210.29.144.1",
    "evidence_hostnames": "njxzc.edu.cn; www.njxzc.edu.cn",
    "review_notes": "Organization type and CERNIC registration not yet individually confirmed; root kept because all edu.cn entities are in scope; CERNIC IPv6 list combines CERNET and direct-connected/academic ranges; overlap is only a network clue; DNS checked 2026-09-26 via Google Public DNS; transient SERVFAIL retried with Cloudflare DNS where available.; Also listed in community-maintained China university domain index; this source is not official and may be stale.; Scope is exactly one label directly under edu.cn; deeper observed hostnames are rolled up to that root. No organization-type filtering.; Also present in community-maintained Chinese university domain index; source is non-official and may be stale. Included without institution-type filtering.; CERNIC rechecked by background HTTP on 2026-10-04; original discovery and DNS evidence dates retained."
  },
  "reg_date": null,
  "raw_text": "\nWhois Results for njxzc.edu.cn  \n\n\n \n\n\n\nWhois Query\n\n对象关键字查询\n\non accurate entity keys\n\n\n\n\n\n\n\n\n                     \n\n\n\nWhois njxzc.edu.cn  ?\n\n\n\n\nNanjing Xiaozhuang College \n   Nanjing, JS 210017\n   China\n\n   Domain Name: NJXZC.EDU.CN\n\n   Network Name:   NJNC-CN\n\n   Administrative Contact:\n      Guangyong Song  (GS1-CER) \n   Network Name:   NJNC-CN\n\n   Technical Contact:\n      Yufeng Min  (YM4-CER) \n\n   Domain Servers in listed order:\n\n   dns1.njxzc.edu.cn   \t210.29.144.1\n   dns2.njxzc.edu.cn   \t210.29.144.2\n\n\n\n\n\n\n"
}
