{
  "root_domain": "cauc.edu.cn",
  "type": "full_record",
  "org_en": "Civil Aviation Institute Of China",
  "org_cn": null,
  "domain_name": "CAUC.EDU.CN",
  "network_name": "CAIC-CN",
  "admin_contact": "Xingjie Feng (XF16-CER)",
  "nameservers": [
    {
      "host": "NS1.CAUC.EDU.CN",
      "ip": "202.113.32.6",
      "ipv6": "2001:DA8:A012::6"
    },
    {
      "host": "NS2.CAUC.EDU.CN",
      "ip": "202.113.32.2",
      "ipv6": "2001:DA8:A012::2"
    }
  ],
  "address": [
    "Tianjin, TJ 300300",
    "China"
  ],
  "raw_note": null,
  "schema_version": "2.0",
  "whois_queried": "2026-10-04",
  "source_url": "https://www.nic.edu.cn/cgi-bin/reg/otherobj?query=cauc.edu.cn",
  "metadata": {
    "organization_or_record_name": "Civil Aviation Institute Of China",
    "collected_from": "Community-maintained Chinese university-domain index (GitHub)",
    "source_last_observed": "2026-09-26 (source snapshot; no per-domain date)",
    "current_dns_status": "A=NOERROR; AAAA=NOERROR; NS=NOERROR",
    "A_records": "",
    "AAAA_records": "",
    "NS_records": "ns1.cauc.edu.cn; ns2.cauc.edu.cn",
    "CERNIC_WHOIS_status": "CERNIC HTTP query: full_record (queried 2026-10-04)",
    "CERNET_address_list_association": "No current A/AAAA overlap found in the public lists; not proof of non-CERNET use",
    "evidence_hostnames": "www.cauc.edu.cn",
    "review_notes": "Direct *.edu.cn root candidate discovered via community-maintained China university domain index; not registry-verified. Included regardless of organization type.; DNS checked 2026-09-26 via Google Public DNS DoH.; Also present in community-maintained Chinese university domain index; source is non-official and may be stale. Included without institution-type filtering.; Only one-label-under-edu.cn roots are listed; deeper hostnames roll up to this root. No organization-type filtering.; CERNIC rechecked by background HTTP on 2026-10-04; original discovery and DNS evidence dates retained."
  },
  "reg_date": null,
  "raw_text": "\nWhois Results for cauc.edu.cn  \n\n\n \n\n\n\nWhois Query\n\n对象关键字查询\n\non accurate entity keys\n\n\n\n\n\n\n\n\n                     \n\n\n\nWhois cauc.edu.cn  ?\n\n\n\n\nCivil Aviation Institute Of China \n   Tianjin, TJ 300300\n   China\n\n   Domain Name: CAUC.EDU.CN\n\n   Network Name:   CAIC-CN\n\n   Administrative Contact, Technical Contact:\n      Xingjie Feng  (XF16-CER) \n\n   Domain Servers in listed order:\n\n   NS1.CAUC.EDU.CN     \t202.113.32.6\t2001:DA8:A012::6\n   NS2.CAUC.EDU.CN     \t202.113.32.2\t2001:DA8:A012::2\n\n\n\n\n\n\n"
}
