{
  "root_domain": "hncst.edu.cn",
  "type": "full_record",
  "org_en": "Hainan College of Software Technology",
  "org_cn": null,
  "domain_name": "HNCST.EDU.CN",
  "network_name": "HNSPI-CN",
  "admin_contact": "Jianghao Huang (JH56-CER)",
  "nameservers": [
    {
      "host": "dns1.hncst.edu.cn",
      "ip": "222.17.240.2"
    },
    {
      "host": "dns2.hncst.edu.cn",
      "ip": "222.17.240.3"
    }
  ],
  "address": [
    "Qionghai, HI 571400",
    "China"
  ],
  "raw_note": null,
  "schema_version": "2.0",
  "whois_queried": "2026-09-26",
  "source_url": "https://www.nic.edu.cn/cgi-bin/reg/otherobj?query=hncst.edu.cn",
  "metadata": {
    "organization_or_record_name": "海南软件职业技术学院",
    "collected_from": "Community-maintained Chinese university-domain index (GitHub)",
    "source_last_observed": "2026-09-26 (source snapshot; no per-domain date)",
    "current_dns_status": "A=NOERROR; AAAA=NOERROR; NS=NOERROR",
    "A_records": "",
    "AAAA_records": "",
    "NS_records": "dns2.hncst.edu.cn",
    "CERNIC_WHOIS_status": "Confirmed full CERNIC WHOIS record (queried 2026-09-26)",
    "CERNET_address_list_association": "No current A/AAAA overlap found in the public lists; not proof of non-CERNET use",
    "evidence_hostnames": "www.hncst.edu.cn",
    "review_notes": "Direct *.edu.cn root candidate discovered via community-maintained China university domain index; not registry-verified. Included regardless of organization type.; DNS checked 2026-09-26 via Google Public DNS DoH.; Also present in community-maintained Chinese university domain index; source is non-official and may be stale. Included without institution-type filtering.; Only one-label-under-edu.cn roots are listed; deeper hostnames roll up to this root. No organization-type filtering.; Legacy schema migration: original WHOIS query date recovered from 2026-10-04 cumulative CSV; original page raw_text unavailable in this per-domain file."
  },
  "reg_date": null,
  "raw_text": null
}
